{"approval":{"approved":false,"blockers":["COMPLETE_EXACT_RUNTIME_CLOSURE_ABSENT","EXTERNAL_INDEPENDENT_NUMERIC_APPROVAL_ABSENT","REPRESENTATIVE_WORKLOAD_ADEQUACY_EVIDENCE_ABSENT","SELECTED_SOURCE_COMMIT_AND_TREE_BINDING_ABSENT","SIGNED_REVIEW_RECEIPT_AND_TRUST_POLICY_ABSENT"],"review_receipt_digest":null,"state":"NON_AUTHORITATIVE_PROPOSAL_PENDING_EXTERNAL_DECISION"},"authoritative":false,"bindings":{"prototype_measurement_digest":"sha256:e1f6edee97feb98aa56c9da27cecbd7b6f47afe11e8540b6a37e747982b2a78d","prototype_pack_manifest_digest":"sha256:8edde9f6041a61e44130c50db57eb02b1cdcfdcb13c912ba020956d8df642bed","prototype_program_digest":"sha256:7f633a9ce454dbc833e53d71aef7fa0e0f00065b85278a128faa97377d476a4b","runtime_inventory_digest":"sha256:119db47cffd2f30c129cac0d292faa14fece30ca519f69c986066eb246016888","structural_census_digest":"sha256:f22e200259fc2b309e75aaa1631aa62fb056ec6855dc6e5351cbeaf91b73d4b3"},"boundary_evidence":[{"derivation":"RETAIN_SHIPPED_VALUE_WITH_EXECUTED_N_MINUS_1_AND_N_AND_FIXED_FAIL_CLOSED_N_PLUS_1/1","dimension":"max_program_bytes","measurement_row_digest":"sha256:00fc87985b5c414f65399eaf777986bdc2a4798625b60e67f78480fee03db817","n_minus_1_outcome":"EXECUTED_NONAUTHORITATIVE","n_outcome":"EXECUTED_NONAUTHORITATIVE","n_plus_1_error":"PROGRAM_BYTE_LIMIT","n_plus_1_outcome":"REFUSED_NONAUTHORITATIVE","proposed_ceiling":262144},{"derivation":"RETAIN_SHIPPED_VALUE_WITH_EXECUTED_N_MINUS_1_AND_N_AND_FIXED_FAIL_CLOSED_N_PLUS_1/1","dimension":"max_input_bytes","measurement_row_digest":"sha256:4d994be4fe947fe04c37e4fc700caa11bebcd1bbb48293631c3df6706abcf285","n_minus_1_outcome":"EXECUTED_NONAUTHORITATIVE","n_outcome":"EXECUTED_NONAUTHORITATIVE","n_plus_1_error":"INPUT_BYTE_LIMIT","n_plus_1_outcome":"REFUSED_NONAUTHORITATIVE","proposed_ceiling":1048576},{"derivation":"RETAIN_SHIPPED_VALUE_WITH_EXECUTED_N_MINUS_1_AND_N_AND_FIXED_FAIL_CLOSED_N_PLUS_1/1","dimension":"max_output_bytes","measurement_row_digest":"sha256:1a2076298b880321b3792246846c3bce7747a868025baa7ef4b4aed5b1b121a1","n_minus_1_outcome":"EXECUTED_NONAUTHORITATIVE","n_outcome":"EXECUTED_NONAUTHORITATIVE","n_plus_1_error":"OUTPUT_BYTE_LIMIT","n_plus_1_outcome":"REFUSED_NONAUTHORITATIVE","proposed_ceiling":131072},{"derivation":"RETAIN_SHIPPED_VALUE_WITH_EXECUTED_N_MINUS_1_AND_N_AND_FIXED_FAIL_CLOSED_N_PLUS_1/1","dimension":"max_rules","measurement_row_digest":"sha256:b2f765ce6935585f7d78b896b927f7c96872168808c55a9842924d06a4f79b86","n_minus_1_outcome":"EXECUTED_NONAUTHORITATIVE","n_outcome":"EXECUTED_NONAUTHORITATIVE","n_plus_1_error":"RULE_LIMIT","n_plus_1_outcome":"REFUSED_NONAUTHORITATIVE","proposed_ceiling":1024},{"derivation":"RETAIN_SHIPPED_VALUE_WITH_EXECUTED_N_MINUS_1_AND_N_AND_FIXED_FAIL_CLOSED_N_PLUS_1/1","dimension":"max_expression_depth","measurement_row_digest":"sha256:fad57dfae3550b549ace6fb917d77cce3fdaf4a40488778fe3ca941f00e52595","n_minus_1_outcome":"EXECUTED_NONAUTHORITATIVE","n_outcome":"EXECUTED_NONAUTHORITATIVE","n_plus_1_error":"EXPRESSION_DEPTH_LIMIT","n_plus_1_outcome":"REFUSED_NONAUTHORITATIVE","proposed_ceiling":32},{"derivation":"RETAIN_SHIPPED_VALUE_WITH_EXECUTED_N_MINUS_1_AND_N_AND_FIXED_FAIL_CLOSED_N_PLUS_1/1","dimension":"max_expression_nodes","measurement_row_digest":"sha256:d7166d3a8b0027e40c9a8866c3e76fac08377bf5009aa5726e0dca64e98b02bd","n_minus_1_outcome":"EXECUTED_NONAUTHORITATIVE","n_outcome":"EXECUTED_NONAUTHORITATIVE","n_plus_1_error":"EXPRESSION_NODE_LIMIT","n_plus_1_outcome":"REFUSED_NONAUTHORITATIVE","proposed_ceiling":4096},{"derivation":"RETAIN_SHIPPED_VALUE_WITH_EXECUTED_N_MINUS_1_AND_N_AND_FIXED_FAIL_CLOSED_N_PLUS_1/1","dimension":"max_operator_operands","measurement_row_digest":"sha256:d0eaea9d51cc2c8e34d033661e4158facfa6c9f84964581d64f067e10bca3268","n_minus_1_outcome":"EXECUTED_NONAUTHORITATIVE","n_outcome":"EXECUTED_NONAUTHORITATIVE","n_plus_1_error":"OPERATOR_OPERAND_LIMIT","n_plus_1_outcome":"REFUSED_NONAUTHORITATIVE","proposed_ceiling":256},{"derivation":"RETAIN_SHIPPED_VALUE_WITH_EXECUTED_N_MINUS_1_AND_N_AND_FIXED_FAIL_CLOSED_N_PLUS_1/1","dimension":"max_path_segments","measurement_row_digest":"sha256:ae934cbd5270dfbc48732979cc7a700b2f3a0bcdbaf1f3473941d2c6519eb083","n_minus_1_outcome":"EXECUTED_NONAUTHORITATIVE","n_outcome":"EXECUTED_NONAUTHORITATIVE","n_plus_1_error":"PATH_SEGMENT_LIMIT","n_plus_1_outcome":"REFUSED_NONAUTHORITATIVE","proposed_ceiling":32},{"derivation":"RETAIN_SHIPPED_VALUE_WITH_EXECUTED_N_MINUS_1_AND_N_AND_FIXED_FAIL_CLOSED_N_PLUS_1/1","dimension":"max_string_bytes","measurement_row_digest":"sha256:e660e0302af6f681c0a68874ea6d198e5ad9446cfb4b4d645d227b4de91fbdb9","n_minus_1_outcome":"EXECUTED_NONAUTHORITATIVE","n_outcome":"EXECUTED_NONAUTHORITATIVE","n_plus_1_error":"STRING_BYTE_LIMIT","n_plus_1_outcome":"REFUSED_NONAUTHORITATIVE","proposed_ceiling":65536},{"derivation":"RETAIN_SHIPPED_VALUE_WITH_EXECUTED_N_MINUS_1_AND_N_AND_FIXED_FAIL_CLOSED_N_PLUS_1/1","dimension":"max_set_items","measurement_row_digest":"sha256:efdd482774397f44e470d0688301f7facb22ad60b0b851aebcb7b4eadcf9ee70","n_minus_1_outcome":"EXECUTED_NONAUTHORITATIVE","n_outcome":"EXECUTED_NONAUTHORITATIVE","n_plus_1_error":"SET_ITEM_LIMIT","n_plus_1_outcome":"REFUSED_NONAUTHORITATIVE","proposed_ceiling":1024},{"derivation":"RETAIN_SHIPPED_VALUE_WITH_EXECUTED_N_MINUS_1_AND_N_AND_FIXED_FAIL_CLOSED_N_PLUS_1/1","dimension":"max_input_nodes","measurement_row_digest":"sha256:bf699f78af67bc1f45e9a79bb917d5b17bd80bab46503728425968e7e7af6f25","n_minus_1_outcome":"EXECUTED_NONAUTHORITATIVE","n_outcome":"EXECUTED_NONAUTHORITATIVE","n_plus_1_error":"INPUT_NODE_LIMIT","n_plus_1_outcome":"REFUSED_NONAUTHORITATIVE","proposed_ceiling":16384},{"derivation":"RETAIN_SHIPPED_VALUE_WITH_EXECUTED_N_MINUS_1_AND_N_AND_FIXED_FAIL_CLOSED_N_PLUS_1/1","dimension":"max_instruction_fuel","measurement_row_digest":"sha256:4ffb285b4c6000f0f2d66e7582089ea58ea16cb6c5a4caf1e7a223f122db4629","n_minus_1_outcome":"EXECUTED_NONAUTHORITATIVE","n_outcome":"EXECUTED_NONAUTHORITATIVE","n_plus_1_error":"INSTRUCTION_FUEL_LIMIT","n_plus_1_outcome":"REFUSED_NONAUTHORITATIVE","proposed_ceiling":32768}],"core_budget_proposal":{"census_method":"atlas.python-executable-statement-census/1","formula":"CEIL_TO_MULTIPLE(CEIL(MEASURED*110/100),256)/1","headroom_basis_points":1202,"headroom_ratio_denominator":100,"headroom_ratio_numerator":110,"headroom_statements":852,"measured_executable_statements":7084,"proposed_core_sloc_budget":7936,"rounding_quantum":256},"dsl_resource_profile_proposal":{"max_expression_depth":32,"max_expression_nodes":4096,"max_input_bytes":1048576,"max_input_nodes":16384,"max_instruction_fuel":32768,"max_operator_operands":256,"max_output_bytes":131072,"max_path_segments":32,"max_program_bytes":262144,"max_rules":1024,"max_set_items":1024,"max_string_bytes":65536,"schema":"atlas.dsl-only-resource-profile/1","substrate":"DECLARATIVE_DSL_ONLY"},"freeze_overlay_schema":"atlas.r2-tcb-budget-freeze/1","measurement_gaps":["HOST_DEADLINE_CANCELLATION_CONCURRENCY_AND_THROUGHPUT_NOT_MEASURED","PAIRWISE_INPUT_BYTES_NODES_DEPTH_AND_STRING_PRESSURE_NOT_MEASURED","PAIRWISE_PROGRAM_BYTES_RULES_NODES_DEPTH_AND_SETS_NOT_EXHAUSTIVE","PROCESS_RSS_AND_NATIVE_ALLOCATIONS_NOT_MEASURED","REFERENCE_DENOMINATOR_IS_ONE_WINDOWS_CPYTHON_HOST","REPRESENTATIVE_FIELD_WORKLOAD_DENOMINATOR_ABSENT","RUNTIME_CLOSURE_REMAINS_PARTIAL_NONPORTABLE_PROTOTYPE","UNINSTRUMENTED_DEPTH_OPERAND_PATH_STRING_AND_SET_TARGETS_ARE_SIGNED_AGGREGATE_CLAIMS_ONLY"],"pack_budget_proposal":{"census_method":"DECLARATIVE_SEMANTIC_STATEMENT_COUNT/1","declarative_rule_records":6,"expression_operator_nodes":21,"formula":"NEXT_POWER_OF_TWO(MEASURED_SEMANTIC_STATEMENTS)/1","headroom_basis_points":1851,"headroom_semantic_statements":5,"measured_semantic_statements":27,"proposed_pack_sloc_budget":32},"promotion_eligible":false,"proposal_id":"atlas-r2-tcb-budget-proposal.001","qcp_001":{"execution_state":"CONTRACT_ONLY","pack_id":"QCP-001","pack_version":"0.1.0-experimental","promotion_eligible":false,"qualification_effect":"NONE","qualification_state":"EXPERIMENTAL"},"qualification_effect":"NONE","receipt_container_ceiling_proposal":{"bound_receipt_ceiling_bytes":133644,"bound_wrapper_overhead_bytes":923,"formula":"MAX_OUTPUT_BYTES_PLUS_PROFILE_SPECIALIZED_CLOSED_CANONICAL_ENVELOPE_OVERHEAD/1","inner_envelope_overhead_bytes":1649,"inner_receipt_ceiling_bytes":132721,"interpreter_semantics_version":"ATLAS_DECLARATIVE_DSL_SEMANTICS/1","max_output_bytes":131072,"reviewed_receipt_ceiling_bytes":134080,"reviewed_wrapper_overhead_bytes":1359,"schema":"atlas.dsl-receipt-container-ceiling/1"},"release3_included":false,"runtime_closure":{"blind_spot_count":9,"claim_boundary":"Exact-byte inventory of the observed isolated reference process and bounded static PE resolutions only; assumes no compromised same-logon process with handle-duplication, debug, or memory-injection rights; not portable closure, all-branch coverage, qualification, or promotion authority.","complete_exact_runtime_closure":false,"state":"PARTIAL_NONPORTABLE_PROTOTYPE"},"schema":"atlas.r2-tcb-budget-proposal/1","selected_source_commit":null,"selected_source_tree":null,"source_binding_state":"SAME_CHECKOUT_SELF_CHECK_ONLY"}